insight,evidence,interpretation
Unknown почти устранён,"1 операций на 5,793 руб. (0.01% оборота)",Классификация стала пригодной для Cash Flow; оставшийся unknown можно проверить вручную.
Главный денежный расход,"Закупки для производства: 29,804,203 руб.","Именно эту категорию надо разбирать по поставщикам, ценам, объёмам и условиям оплаты."
Концентрация расходного контрагента,"ООО ""РАДУГА Н"": 14,700,980 руб.","Проверить зависимость от поставщика, отсрочки, авансы и возможность переговоров по условиям."
Концентрация поступлений,"ООО ""ТОРГСЕРВИС 150"": 1,473,544 руб.","Если доля топ-клиентов высока, кассовые разрывы могут идти от задержек оплат нескольких покупателей."
Месяцы с отрицательным net cash flow before internal,"2025-05, 2025-07, 2025-09, 2025-12, 2026-02, 2026-04",Эти месяцы надо смотреть как кассовые провалы: какие категории/контрагенты забрали деньги.
Месяцы со слабой операционной маржой cash flow,"2025-05, 2025-07, 2025-08, 2025-09, 2025-10, 2025-11, 2025-12, 2026-01, 2026-02, 2026-03, 2026-04","Даже положительный OCF может быть слишком тонким, если расходы съедают почти все поступления."
Крупнейшая повторяющаяся нагрузка,"ИП Баскаков С. А. / Аренда и коммунальные платежи: 1,999,620 руб., 9 операций",Повторяющиеся платежи формируют базу постоянного cash burn; их надо отделять от разовых закупок.
